QualityID,description_en,description_es
1,"Healthy and vigorous tree, optimally shaped, with no signs of aging, capable of producing many high-value products, not suppressed and with excellent future prospects.","Árbol sano, vigoroso, óptimamente conformado, sin señales de vejez, capaz de proporcionar muchos y valiosos productos, no dominado y con excelentes perspectivas de futuro."
2, "Healthy and vigorous tree, not suppressed, with no signs of aging, showing some form defects but capable of producing a considerable amount of valuable products.","Árbol sano, vigoroso, no dominado, sin señales de vejez, con algún defecto de conformación y capaz de proporcionar bastantes productos valiosos."
3,"Tree not entirely healthy and vigorous, or somewhat old or suppressed, with several form defects, but still capable of producing some valuable products.","Árbol no totalmente sano y vigoroso, o algo viejo o dominado, con bastantes defectos de conformación, pero capaz de proporcionar algunos productos valiosos."
4,"Tree that is diseased and weak or old, with many form defects, only capable of producing low-value products.","Árbol enfermo y débil o viejo, con muchos defectos de conformación, solamente capaz de proporcionar productos de valor secundario."
5,"Tree that is very diseased, weak or old, with very poor form and scarce, low-value yields.","Árbol muy enfermo, débil o viejo, con pésima conformación y aprovechamientos escasos y de poco valor."
6,"Dead tree not yet decayed and still capable of providing some usable material.","Árbol muerto pero sin pudrir aún y capaz todavía de proporcionar algún bien aprovechable."